"Product Details","ASIN","Brand","Price","Sales","Revenue","BSR","FBA Fees","Active Sellers #","Ratings","Review Count","Images","Review velocity","Buy Box","Category","Size Tier","Delivery","Dimensions","Weight","Creation Date"
"($) SLOVIC Resistance Tube/Band with Sturdy Handles, Door Anchor for Men and Women with Extensive Guide Containing 30 Plus Exercises.","B08H87CXNR","SLOVIC","₹2,599.00",287,"688,513.00",184,"n/a",1,4.3,1385,7,-91,"n/a","Sports, Fitness & Outdoors","Standard-Oversize","FBA","7.5x12.9x4.3",2.65,"3/22/2020"
"($) SLOVIC Resistance Band/Pull Up Band/Resistance Bands 42 Inch with Door Anchor for Calisthenics with Physical Booklet with 30 Exercises.","B07KTXLQYF","SLOVIC","₹749.00","1,338","935,262.00",98,"₹173.35",1,4.3,2024,6,197,"n/a","Sports, Fitness & Outdoors","Standard-Oversize","FBA","3.2x11.5x1.7",0.62,"11/22/2018"
"($) Fit Mammal Resistance Band Set-Resistance Bands for Workout for Men & Women- Warranty for Life- Heavy Resistance Tube Gym Band & Stretch Band for Exercise- 50+ Exercise Bands E-Book Included","B08HS3FVYH","Fit Mammal","₹2,499.00","1,008","2,518,992.00",198,"₹440.05",1,4.6,456,8,64,"n/a","Sports, Fitness & Outdoors","Standard-Oversize","FBA","10.2x13.7x4.8",2.01,"11/3/2020"
"kossto Double Toning Resistance Tube Heavy Quality Exercise Band for Stretching, Full Body Workout, Home Gym and Toning for Men and Women","B091Q6DH8Q","kossto","₹399.00","2,097","836,703.00",13,"₹189.85",1,3.9,810,9,313,"n/a","Sports, Fitness & Outdoors","Standard-Oversize","FBA","4.7x7.1x2.4",1.01,"4/5/2021"
"Boldfit Heavy Resistance Band for Exercise & Stretching, Pull Up Bar Suitable in Home & Gym Workout for Men & Women.","B08D8J5BVR","Boldfit","₹569.00","2,099","1,194,331.00",22,"₹176.34",1,4.1,1712,6,468,"n/a","Sports, Fitness & Outdoors","Standard-Oversize","FBA","4.9x10.8x1.2",0.26,"7/1/2020"
"RYLAN Resistance Exercise Bands with Door Anchor, Handles, Waterproof Carry Bag, Legs Ankle Straps for Resistance Training, Physical Therapy, Home Workouts, Resistance Band.","B096NLF1ZF","Rylan","₹799.00","1,674","1,337,526.00",41,"₹206.37",1,4.5,315,8,194,"n/a","Sports, Fitness & Outdoors","Standard-Oversize","FBA","3.1x3.1x2.8",0.50,"2/3/2021"
"Rewup Resistance Bands Set (11pcs), Exercise Bands with Door Anchor, Handles, Waterproof Carry Bag, Legs Ankle Straps for Resistance Training, Physical Therapy","B0968V1TWZ","Rewup","₹699.00",226,"157,974.00",195,"₹173.35",1,5.0,35,7,19,"n/a","Sports, Fitness & Outdoors","Standard-Oversize","FBA","3.9x4.7x0.8",0.88,"5/31/2021"
"Antbadge Anti-Slip Fabric Resistance Loop Bands for Women & Men. Stretchable Exercise Mini Band to Workout Booty Hips Glutes Thighs Legs abs at Home, Outdoors or Gym","B08NW38S3K","ANTBADGE","₹399.00","1,695","676,305.00",97,"₹159.16",1,4.5,397,8,180,"n/a","Sports, Fitness & Outdoors","Standard-Oversize","FBA","4.7x6.0x1.9",0.31,"11/17/2020"
"Fonthill® Resistance Bands Set (11pcs), Exercise Bands with Door Anchor, Handles, Waterproof Carry Bag, Legs Ankle Straps for Resistance Training, Physical Therapy, Home Workouts","B092PZXZGG","FontHill","₹699.00",982,"686,418.00",618,"n/a",1,4.3,277,5,107,"n/a","Sports, Fitness & Outdoors","n/a","FBA","7.5x9.8x3.1","n/a","4/16/2021"
"HUZB® Double Toning Resistance Band Tube Heavy Quality Exercise Band for Stretching, Full Body Workout, Home Gym and Toning for Men and Women(Multicolor)","B08WKG2LKZ","HUZB","₹379.00","1,310","496,490.00",53,"₹155.28",1,4.3,968,6,195,"n/a","Sports, Fitness & Outdoors","Standard-Oversize","FBA","5.9x5.9x2.4",0.79,"2/9/2021"
"Fashnex Resistance Loop Mini Bands for Men & Women","B08P3Q8DBL","FASHNEX","₹329.00",336,"110,544.00","1,186","₹139.96",1,4.5,114,5,16,"n/a","Sports, Fitness & Outdoors","Standard-Oversize","FBA","4.7x5.9x2.0",0.06,"11/23/2020"
"Ketmart Exercise Bands for Working Out Arms, Legs and Butt-Resistance Bands Set for Women, Men – Physical Therapy, Fitness - 5 Extra Wide Bands of Increasing Resistance","B095K16HF2","ketmart","₹349.00",47,"16,403.00","1,044","n/a",1,5.0,2,6,0,"n/a","Sports, Fitness & Outdoors","n/a","FBA","n/a","n/a","5/21/2021"
"($) Boldfit Resistance Bands Mini Loop (Set of 5) Perfect for Toning & Home Workout.(Carry Bag Included)","B08C7S9RNY","Boldfit","₹696.35","1,603","1,116,249.05",64,"₹202.57",2,4.3,549,7,106,"n/a","Sports, Fitness & Outdoors","Standard-Oversize","FBA","3.9x9.7x3.9",0.37,"7/1/2020"
"($) BULMARC's Resistance Band Pull Up Assist Bands Resistance Bands with 65+ Exercises for Workout, Chin Ups, Pull Ups Stretching, Weight Loss & Powerlifting, Mobility Training Anti Snap Natural Latex","B07XG5H4H3","BULMARC","₹475.00","1,099","522,025.00",297,"₹169.48",1,4.4,532,6,69,"n/a","Sports, Fitness & Outdoors","Standard-Oversize","FBA","4.0x6.2x1.2",0.22,"8/28/2019"
"($) AmazonBasics Resistance and Pull up Band for Chin Ups, Pull Ups and Stretching","B01FN7XCZ4","AmazonBasics","₹759.00","1,078","818,202.00",243,"₹232.80",1,4.2,6895,8,242,"n/a","Sports, Fitness & Outdoors","Standard-Oversize","FBA","7.6x9.3x1.8",0.66,"11/10/2018"
"Fitlastics Resistance Loop Bands Set for Squats, Stretching, Strength Training Exercises, Hips & Glutes Heavy Workouts for Men & Women","B07G6PJFTM","Fitlastics","₹599.00","1,551","882,519.00",105,"₹140.66",1,4.1,1657,9,180,"n/a","Sports, Fitness & Outdoors","Standard-Oversize","FBA","3.2x6.3x0.8",0.44,"8/4/2018"
"ZOSOE Resistance Bands Set (11pcs), Exercise Bands with Door Anchor, Handles, Waterproof Carry Bag, Legs Ankle Straps for Resistance Training, Physical Therapy","B08VDF1KY9","ZOSOE","₹699.00",715,"499,785.00",730,"₹224.66",2,4.1,810,7,174,"n/a","Sports, Fitness & Outdoors","Standard-Oversize","FBA","3.9x4.7x0.8",1.10,"1/29/2021"
"SLOVIC Resistance Band/Pull Up Band/Resistance Bands 42 Inch with Door Anchor for Calisthenics with Physical Booklet with 30 Exercises.","B07KTXLQYF","SLOVIC","₹749.00","1,338","935,262.00",98,"₹173.35",1,4.3,2024,6,197,"n/a","Sports, Fitness & Outdoors","Standard-Oversize","FBA","3.2x11.5x1.7",0.62,"11/22/2018"
"Nivia Lateral Resistance Band and Tubes 2.0","B07KK8Q8YK","Nivia","₹100.00",921,"92,100.00",229,"₹120.36",3,3.8,644,8,71,"n/a","Sports, Fitness & Outdoors","Standard-Oversize","FBA","2.8x5.6x1.0",0.02,"11/15/2018"
"Bulfyss Resistance Tube Exercise Bands for Stretching, Workout, and Toning for Men, and Women with Additional Door Anchor (30-35 lbs) - Random Colour","B08WH6XNNK","Bulfyss","₹399.00",581,"231,819.00",966,"₹159.16",1,4.0,362,6,149,"n/a","Sports, Fitness & Outdoors","Standard-Oversize","FBA","5.1x5.9x3.9",0.37,"2/11/2021"
"Strauss Latex Band, (Set of 5)","B07TLVRKKH","STRAUSS","₹499.00","1,253","625,247.00",211,"₹171.56",2,4.0,818,7,80,"n/a","Sports, Fitness & Outdoors","Standard-Oversize","FBA","4.0x8.3x1.2",0.33,"6/27/2019"
"SLOVIC Resistance Band/Resistance Tube with Sturdy Handles, Door Anchor for Men and Women with Extensive Guide Containing 30 Plus Exercises. (Black 50 LBS)","B08FC5HBV9","SLOVIC","₹499.00",990,"494,010.00",973,"n/a",1,3.8,300,7,"-1,105","n/a","Sports, Fitness & Outdoors","Standard-Oversize","FBA","5.7x15.8x2.4",1.06,"3/22/2020"
"Boldfit Resistance Bands Mini Loop (Set of 5) Perfect for Toning & Home Workout.(Carry Bag Included)","B08C7S9RNY","Boldfit","₹696.35","1,603","1,116,249.05",64,"₹202.57",2,4.3,549,7,106,"n/a","Sports, Fitness & Outdoors","Standard-Oversize","FBA","3.9x9.7x3.9",0.37,"7/1/2020"
"AmazonBasics Resistance and Pull up Band for Chin Ups, Pull Ups and Stretching","B01FN7XCZ4","AmazonBasics","₹759.00","1,078","818,202.00",243,"₹232.80",1,4.2,6895,8,242,"n/a","Sports, Fitness & Outdoors","Standard-Oversize","FBA","7.6x9.3x1.8",0.66,"11/10/2018"
"Arrowmax Workout Bands for Women Legs and Butt Resistance Loop Bands Set of 5 for Home Fitness, Stretching, Strength Training, Physical Therapy, Pilates Flexbands, Natural Latex Exercise Bands","B08FJH6YP5","ArrowMax","₹445.00",332,"141,100.00","1,008","n/a",1,4.3,124,5,19,"n/a","Sports, Fitness & Outdoors","n/a","MFN","3.5x7.1x1.6","n/a","8/10/2020"
"Boldfit Fabric Resistance Band - Loop Hip Band for Women & Men for Hip, Legs, Stretching, Toning Workout. Mini Loop Booty Bands for Glutes, Squats Exercise Usable in-Home & Gym.","B092ZYH51N","Boldfit","₹898.70","1,061","953,520.70",82,"₹225.24",2,4.8,56,7,11,"n/a","Sports, Fitness & Outdoors","Standard-Oversize","FBA","4.0x9.6x3.9",0.97,"4/19/2021"
"Fashnex Resistance Bands Set for Strength Training, Mobility, Toning. Tubes with Foam Handles, Door Anchor, Ankle Straps, Carry Bag for Men/Women (Resistance Band Set of 5 Tubes)","B08VNNQW76","FASHNEX","₹675.00",757,"510,975.00",439,"₹170.81",1,4.0,899,5,117,"n/a","Sports, Fitness & Outdoors","Standard-Oversize","FBA","7.5x7.9x2.0",0.86,"12/9/2020"
"KAJATI® Double Toning Resistance Tube Heavy Quality Exercise Band for Stretching, Full Body Workout, Home Gym and Toning for Men and Women","B08NK3YL8B","KAJATI","₹379.00",907,"343,753.00",289,"n/a",1,4.0,871,7,235,"n/a","Sports, Fitness & Outdoors","n/a","FBA","3.9x4.7x2.0","n/a","11/14/2020"
"FITSY® Resistance Toning Tube + Door Anchor + Carry Pouch + Workout Chart","B07W9D6MLJ","Fitsy","₹649.00","1,710","1,109,790.00",127,"₹198.72",2,4.2,2561,7,274,"n/a","Sports, Fitness & Outdoors","Standard-Oversize","FBA","7.6x9.2x2.3",0.55,"12/15/2019"
"Trezop 11 Pieces Resistance Band Set with Handles, Portable Toning Tubes with Door Anchor. Bag and Ankle Straps Included","B08V1QKZ1Q","TREZOP","₹649.00",394,"255,706.00",631,"₹198.72",1,3.6,108,8,18,"n/a","Sports, Fitness & Outdoors","Standard-Oversize","FBA","7.6x8.2x2.9",1.06,"1/26/2021"
"($) EAYIRA Resistance Band, Exercise Tube - with Door Anchor, for Resistance Training, Physical Therapy, Home Workouts, Boxing Training for Men and Women","B098B76KPD","EAYIRA","₹699.00",18,"12,582.00","7,603","n/a",1,3.7,21,6,0,"n/a","Sports, Fitness & Outdoors","n/a","FBA","n/a","n/a","6/30/2021"
"($) Boldfit Resistance Band Set with Handles, Portable Toning Tubes with Door Anchor & Foam Handles. Resistance Tube Kit with Bag and Ankle Straps Included.","B0978NCZNC","Boldfit","₹2,007.00",61,"122,427.00","9,037","₹348.84",2,4.6,8,6,0,"n/a","Sports, Fitness & Outdoors","Standard-Oversize","FBA","5.9x7.1x5.4",1.57,"6/14/2021"
"($) YISSVIC Resistance Band for Workout 35-85LBS Pull Up Band with Door Anchor Carry Pouch for Men Women Exercise Heavy Weight - Black, 2080x32x4.5mm","B08FYHY4QX","YISSVIC","₹799.00",24,"19,176.00","10,655","₹207.55",1,4.0,47,9,4,"n/a","Sports, Fitness & Outdoors","Standard-Oversize","FBA","4.0x11.4x2.1",0.71,"8/15/2020"