"Product Details","ASIN","Brand","Price","Sales","Revenue","BSR","FBA Fees","Active Sellers #","Ratings","Review Count","Images","Review velocity","Buy Box","Category","Size Tier","Delivery","Dimensions","Weight","Creation Date"
"($) Boldfit Skipping Rope for Men, Women & Children - Jump Rope for Exercise Workout & Weight Loss - Tangle Free Jumping Rope for Kids","B08MWF3TGK","Boldfit","₹499.00","2,185","1,090,315.00",10,"n/a",1,4.1,2548,6,486,"n/a","Sports, Fitness & Outdoors","Standard-Oversize","FBA","4.6x7.2x4.5",0.49,"11/6/2020"
"($) BICHI ENS Skipping Rope for Men, Women & Children - Jump Rope for Exercise Workout & Weight Loss - Tangle Free Jumping Rope for Kids","B096Y8L5LC","BICHI","₹499.00",89,"44,411.00","2,042","₹172.74",1,4.5,40,8,26,"n/a","Sports, Fitness & Outdoors","Standard-Oversize","FBA","3.1x3.9x2.0",0.11,"6/9/2021"
"($) Burnlab Pro Power Plus Weighted Handle Skipping Rope - Anti Slip, Adjustable, Ball Bearing Design for Gym, Crossfit, Double Unders, Speed Jumping, Boxing, Cardio and Weight Loss - for Men and Women","B082VY7F26","Burnlab","₹1,289.00",26,"33,514.00","10,960","₹321.24",3,4.1,37,5,4,"n/a","Sports, Fitness & Outdoors","Standard-Oversize","FBA","5.1x6.0x1.6",0.97,"12/18/2019"
"Aurion Skipping-Rope Jump Skipping Rope for Men, Women, Weight Loss, Kids, Girls, Children, Adult - Best in Fitness, Sports, Exercise, Workout","B07G8FNL3Q","AURION","₹125.00","2,280","285,000.00",3,"₹124.20",1,3.9,12399,9,"1,535","n/a","Sports, Fitness & Outdoors","Standard-Oversize","FBA","5.3x6.8x1.8",0.35,"8/6/2018"
"Boldfit Skipping Rope for Men, Women & Children - Jump Rope for Exercise Workout & Weight Loss - Tangle Free Jumping Rope for Kids","B08MWF3TGK","Boldfit","₹499.00","2,185","1,090,315.00",10,"n/a",1,4.1,2548,6,486,"n/a","Sports, Fitness & Outdoors","Standard-Oversize","FBA","4.6x7.2x4.5",0.49,"11/6/2020"
"Aurion Jump Rope Workout-Professional Skipping Rope Silicone Comfortable Grips, Heavy Jump ropes Adults Fitness Women Men, Cardio Boxing Endurance Training Exercise","B0968JLTLD","AURION","₹99.00","1,908","188,892.00",18,"₹120.25",1,4.1,55,3,24,"n/a","Sports, Fitness & Outdoors","Standard-Oversize","FBA","5.0x7.0x1.0",0.30,"5/31/2021"
"AmazonBasics Standard Jump Rope, Grey","B07TCNBG5Y","AmazonBasics","₹299.00",69,"20,631.00",35,"₹133.80",1,4.4,1621,6,328,"n/a","Sports, Fitness & Outdoors","Standard-Oversize","FBA","6.8x8.7x1.8",0.44,"11/29/2019"
"Vector X Skipping Rope (Black)","B015E1JVN6","Vector X","₹160.00","1,802","288,320.00",51,"n/a",4,4.0,7247,7,414,"n/a","Sports, Fitness & Outdoors","Standard-Oversize","FBA","7.5x9.5x1.6",0.24,"1/1/2017"
"GOCART WITH G LOGO Jump Ropes Sports Fitness Exercise Cotton Sponge Count Rope Skipping Wire Fitness Outdoor Sporting Skip Rope","B07HL6H1VS","GOCART WITH G LOGO","₹325.00","1,260","409,500.00",108,"₹149.13",1,3.8,2144,9,294,"n/a","Sports, Fitness & Outdoors","Standard-Oversize","FBA","7.1x8.4x1.8",0.31,"9/21/2018"
"Strauss Skipping Rope","B07QJ52Q3D","STRAUSS","₹173.00","2,105","364,165.00",45,"₹129.29",2,4.0,5469,7,654,"n/a","Sports, Fitness & Outdoors","Standard-Oversize","FBA","4.8x7.0x1.7",0.24,"1/22/2019"
"Lifelong PVC Home Gym Set 10-20kg Plate 3feet curl Rod and Dumbbells rods with Gym Accessories","B089H1VV8Q","Lifelong","₹129.00","1,402","278,998.00",71,"n/a",2,4.0,2155,7,250,"n/a","Sports, Fitness & Outdoors","Standard-Oversize","FBA","4.4x7.0x1.7",0.29,"6/1/2020"
"GOCART WITH G LOGO Skipping Rope for Men Gym, Women, Weight Loss, Kids, Girls, Children, Adult Best in Sports, Fitness, Exercise, Workout","B07NC3VMX7","GOCART WITH G LOGO","₹299.00","1,045","311,410.00",302,"₹145.46",3,4.0,1042,6,133,"n/a","Sports, Fitness & Outdoors","Standard-Oversize","FBA","6.3x7.2x1.9",0.42,"2/1/2019"
"($) Burnlab Active Metallic Handle Speed Skipping Rope with Adjustable Length Rope and Anti-Slip Handles, Perfect for Crossfit, Double Unders and HIIT Cardio","B07Q4FD298","Burnlab","₹702.00",554,"388,908.00",880,"₹194.38",2,4.2,296,9,49,"n/a","Sports, Fitness & Outdoors","Standard-Oversize","FBA","3.8x7.2x1.0",0.40,"3/29/2019"
"($) AmazonBasics Adjustable Jump Rope","B074XGYFXD","AmazonBasics","₹349.00",2,698.00,"4,106","₹152.38",1,4.0,1495,6,38,"n/a","Sports, Fitness & Outdoors","Standard-Oversize","FBA","5.8x10.4x1.3",0.24,"3/4/2020"
"($) Fitventure Skipping Rope / Jump Rope, Grey Colour, Adjustable, Tangle Free, 9ft Long, Best For Home / Gym, For Men, Women, Kids & Adults, For Crossfit, Double Under, Speed Jumping, Cardio, Strength Training, Weight / Fat Loss & Overall Body Workout.","B08RJ3XDRD","M & A FITVENTURE","₹349.00",12,"4,188.00","30,145","₹133.51",1,3.0,3,8,0,"n/a","Sports, Fitness & Outdoors","Standard-Oversize","FBA","6.5x6.5x2.0",0.60,"12/29/2020"
"Simran Sports Jumping Skipping Rope for Gym Training, Exercise and Workout","B07HKLRJ6D","Simran Sports","₹138.00",726,"100,188.00",193,"₹125.58",2,4.1,141,9,27,"n/a","Sports, Fitness & Outdoors","Standard-Oversize","FBA","4.8x8.5x1.5",0.37,"9/21/2018"
"Prime Wooden Jumping Skipping Rope | Unisex | Brown Handle | White Rope | Exercise & Fitness & Workout |","B0966XPLHM","Generic","₹159.00",552,"87,768.00",524,"₹108.93",3,4.4,17,1,10,"n/a","Sports, Fitness & Outdoors","Standard-Oversize","FBA","2.8x9.8x1.2",0.20,"5/30/2021"
"Rioff® Skipping Rope for Men Women Gym Training, Exercise and Workout Adjustable","B08BKNNTRW","Rioff","₹199.00",152,"30,248.00",565,"n/a",1,4.1,439,6,83,"n/a","Sports, Fitness & Outdoors","n/a","FBA","1.6x4.7x1.6","n/a","6/21/2020"
"GOCART WITH G LOGO Jump Rope, Tangle-Free Rapid Speed Jumping Rope Cable with Ball Bearings for Women, Men, and Kids, Adjustable Steel Skipping Rope with Foam Handles for Gym Fitness, Home Exercise","B08RXW8BHV","GOCART WITH G LOGO","₹299.00",503,"150,397.00","1,518","₹145.60",1,3.9,124,7,25,"n/a","Sports, Fitness & Outdoors","Standard-Oversize","FBA","5.1x7.2x1.5",0.09,"1/3/2021"
"Henco Jumping Skipping Rope, Jumping Trainer Adjustable Size","B079TP19NP","HENCO","₹183.00",693,"126,819.00",214,"₹130.35",3,4.1,675,1,78,"n/a","Sports, Fitness & Outdoors","Standard-Oversize","FBA","3.0x6.0x1.2",0.37,"2/14/2018"
"ABB INITIO Adjustable Slim Shape Weight Loss Ball Pencil Speed Skipping Rope","B07P655YSJ","ABB INITIO GYM","₹129.00",495,"63,855.00",452,"₹124.62",3,4.1,360,2,40,"n/a","Sports, Fitness & Outdoors","Standard-Oversize","FBA","5.9x7.7x1.8",0.24,"2/28/2019"
"TEMPEST Blue Skipping Rope for Men, Women, Weight Loss, Kids, Girls, Children, Adult - Best in Fitness, Sports, Exercise, Workout","B08V6Q8J44","Tempest","₹159.00",429,"68,211.00",761,"₹127.81",1,4.0,74,3,39,"n/a","Sports, Fitness & Outdoors","Standard-Oversize","FBA","5.9x7.9x1.6",0.33,"1/27/2021"
"Generic Smash Enterpises Thick Cotton Skipping Rope for Women,Girls,Boys (Pack of 1), White (GHAJSKAJM9)","B08GN35BVV","Generic","₹85.00",256,"21,760.00",430,"₹118.77",9,3.5,83,3,16,"n/a","Sports, Fitness & Outdoors","Standard-Oversize","MFN","5.6x7.9x1.3",0.29,"8/24/2020"
"VIFITKIT Jump Rope Adjustable Digital Counting Jump Rope for Kids Women Men Skipping Ropes for Boxing Training Weight Loss Exercise Workout (Assorted Colour)","B08TWXGZ5R","VIFITKIT","₹289.00",666,"192,474.00",806,"₹144.24",1,3.6,477,8,56,"n/a","Sports, Fitness & Outdoors","Standard-Oversize","FBA","2.4x3.9x2.0",0.44,"1/25/2021"
"TEMPEST Yellow Skipping-Rope Jump Skipping Rope for Men, Women, Weight Loss, Kids, Girls, Children, Adult - Best in Fitness, Sports, Exercise, Workout","B08V6KHNR6","Tempest","₹159.00",110,"17,490.00",992,"₹127.81",1,4.3,6,3,2,"n/a","Sports, Fitness & Outdoors","Standard-Oversize","FBA","5.9x7.9x1.6",0.33,"1/27/2021"
"NICTOR Fitness Jumping Adjustable Skipping Rope Gym Training Exercise and Workout for Mem & Women","B08KS7N7XH","NICTOR","₹210.00",793,"166,530.00",339,"n/a",1,4.2,423,9,74,"n/a","Sports, Fitness & Outdoors","n/a","FBA","n/a","n/a","10/5/2020"
"Lordz Adjustable Skipping Rope Tangle-Free with Ball Bearings Rapid Speed Jump Rope Cable and Memory Foam Handles Ideal for Aerobic Exercise Like Speed Training, Endurance Training and Fitness Gym","B08GHHNHTT","Lordz","₹225.00",772,"173,700.00",175,"n/a",1,4.0,1196,7,114,"n/a","Sports, Fitness & Outdoors","n/a","FBA","4.3x6.7x1.6","n/a","9/2/2020"
"Sportif Skipping Rope with Length Adjustable for Kids, Girls, Women, Men for Exercise, Workout, Training and Weight Loss","B08DY7YYX3","Sportif","₹180.00",465,"83,700.00",554,"n/a",1,3.7,191,2,28,"n/a","Sports, Fitness & Outdoors","n/a","FBA","n/a","n/a","7/30/2020"
"AmazonBasics Plastic Speed Jump Rope, Black","B07T9L6JX1","AmazonBasics","₹299.00",109,"32,591.00",558,"₹123.78",1,3.9,752,6,85,"n/a","Sports, Fitness & Outdoors","Standard-Oversize","FBA","6.7x8.7x1.2",0.20,"11/29/2019"
"masira skipping rope in cotton and wood handle for man woman","B097BFK9QD","Generic","₹151.00","n/a","n/a","10,118","n/a",2,"n/a","n/a","n/a",0,"n/a","Sports, Fitness & Outdoors","n/a","FBA","n/a","n/a","6/16/2021"
"($) AmazonBasics Standard Jump Rope, Grey","B07TCNBG5Y","AmazonBasics","₹299.00",69,"20,631.00",35,"₹133.80",1,4.4,1621,6,328,"n/a","Sports, Fitness & Outdoors","Standard-Oversize","FBA","6.8x8.7x1.8",0.44,"11/29/2019"
"($) INCHDOWN® Skipping Rope for Men, Women & Kids (Hand Grip + Skipping Rope)","B098Q7YQMC","INCHDOWN","₹699.00",9,"6,291.00","11,085","₹192.80",1,"n/a","n/a",1,0,"n/a","Sports, Fitness & Outdoors","Standard-Oversize","FBA","5.5x7.5x2.0",0.66,"7/6/2021"
"($) Burnlab Weighted Skipping Rope","B07XXRH4QL","Burnlab","₹1,043.00",64,"55,808.00","9,770","₹276.45",2,4.0,60,5,1,"n/a","Sports, Fitness & Outdoors","Standard-Oversize","FBA","8.9x11.9x2.5",2.18,"9/15/2019"